### ISSUE TITLE
Geth do not acceps transaction from parity

### ISSUE THREAD

**Issue by iFA88** [ethereum/go-ethereum#3194]
Geth do not acceps transaction from parity. It works when i send: geth -> parity, geth <-> geth.
Geth/v1.5.0-unstable-6952fe3a/linux/go1.7
Parity/v1.3.9-beta-e9987c4-20161021/x86_64-windows-msvc/rustc1.12.0

Parity:
```
2016-10-23 14:31:05  IO Worker #0 INFO import      0/ 1/25 peers     72 KiB db  137 KiB chain  0 bytes queue   16 KiB sync
2016-10-23 14:31:34  IO Worker #1 TRACE sync  0 -> NewBlock (94ee…5c43)
2016-10-23 14:31:34  IO Worker #1 TRACE sync  New block queued 94ee174ac9aabb68e3337e9adf935fa0b59ae2e5066975e28e0932b580265c43 (665)
2016-10-23 14:31:34  Verifier #1 TRACE sync  Sending NewHashes to []
2016-10-23 14:31:34  Verifier #1 TRACE sync  Sending NewBlocks to []
2016-10-23 14:31:34  Verifier #1 TRACE sync  Sent 1 transactions to 1 peers.
2016-10-23 14:31:34  Verifier #1 INFO import  Imported #665 94ee…5c43 (0 txs, 0.00 Mgas, 0.40 ms, 0.52 KiB) + another 1 block(s)
2016-10-23 14:31:34  IO Worker #0 TRACE sync  0 -> NewHashes (1 entries)
2016-10-23 14:31:34  IO Worker #0 TRACE sync  New block hash already in chain 94ee174ac9aabb68e3337e9adf935fa0b59ae2e5066975e28e0932b580265c43
2016-10-23 14:31:34  IO Worker #0 TRACE sync  0 -> NewBlock (56fc…97ae)
2016-10-23 14:31:34  IO Worker #0 TRACE sync  New block queued 56fc7c6c48695fc31fbc59b787c43a8ffb713bd3fd820d5d6a842612c2e797ae (666)
2016-10-23 14:31:34  Verifier #1 TRACE sync  Sending NewHashes to []
2016-10-23 14:31:34  Verifier #1 TRACE sync  Sending NewBlocks to []
2016-10-23 14:31:34  Verifier #1 TRACE sync  Sent 1 transactions to 1 peers.
2016-10-23 14:31:34  IO Worker #3 TRACE sync  0 -> NewHashes (1 entries)
2016-10-23 14:31:34 IO Worker #3 TRACE sync New block hash already in chain 56fc7c6c48695fc31fbc59b787c43a8ffb713bd3fd820d5d6a842612c2e797ae
```

Geth:
```
I1023 14:31:25.823631 eth/downloader/downloader.go:1449] Quality of service: rtt 20s, conf 1.000, ttl 1m0s
I1023 14:31:34.004928 miner/miner.go:136] Starting mining operation (CPU=1 TOT=2)
I1023 14:31:34.005237 core/state/state_object.go:231] 993682ad2dc9738268523da901398712e69af76e: #3 3250000840000000000000 (+ 5000000000000000000)
I1023 14:31:34.005344 miner/worker.go:539] commit new work on block 665 with 0 txs & 0 uncles. Took 329.984µs
I1023 14:31:34.005380 miner/agent.go:110] (re)started agent[0]. mining...
I1023 14:31:35.127575 core/database_util.go:368] stored block total difficulty [94ee174a…]: 87309632
I1023 14:31:35.127720 core/database_util.go:354] stored block body [94ee174a…]
I1023 14:31:35.127823 core/database_util.go:340] stored header #665 [94ee174a…]
I1023 14:31:35.128105 miner/worker.go:342] 🔨  Mined block (#665 / 94ee174a). Wait 5 blocks for confirmation
I1023 14:31:35.128305 core/state/state_object.go:231] 993682ad2dc9738268523da901398712e69af76e: #3 3255000840000000000000 (+ 5000000000000000000)
I1023 14:31:35.128429 miner/worker.go:539] commit new work on block 666 with 0 txs & 0 uncles. Took 266.33µs
I1023 14:31:35.128581 core/state/state_object.go:231] 993682ad2dc9738268523da901398712e69af76e: #3 3255000840000000000000 (+ 5000000000000000000)
I1023 14:31:35.128666 miner/worker.go:539] commit new work on block 666 with 0 txs & 0 uncles. Took 182.289µs
I1023 14:31:35.128729 miner/agent.go:110] (re)started agent[0]. mining...
I1023 14:31:35.128888 core/database_util.go:403] stored block receipts [94ee174a…]
I1023 14:31:35.129086 miner/agent.go:110] (re)started agent[0]. mining...
I1023 14:31:35.146368 core/database_util.go:368] stored block total difficulty [56fc7c6c…]: 87440768
I1023 14:31:35.146435 core/database_util.go:354] stored block body [56fc7c6c…]
I1023 14:31:35.146550 core/database_util.go:340] stored header #666 [56fc7c6c…]
I1023 14:31:35.146828 miner/worker.go:342] 🔨  Mined block (#666 / 56fc7c6c). Wait 5 blocks for confirmation
I1023 14:31:35.146960 core/state/state_object.go:231] 993682ad2dc9738268523da901398712e69af76e: #3 3260000840000000000000 (+ 5000000000000000000)
I1023 14:31:35.147058 miner/worker.go:539] commit new work on block 667 with 0 txs & 0 uncles. Took 200.408µs
I1023 14:31:35.147156 core/state/state_object.go:231] 993682ad2dc9738268523da901398712e69af76e: #3 3260000840000000000000 (+ 5000000000000000000)
I1023 14:31:35.147227 miner/worker.go:539] commit new work on block 667 with 0 txs & 0 uncles. Took 133.062µs
I1023 14:31:35.147284 miner/agent.go:110] (re)started agent[0]. mining...
I1023 14:31:35.147617 core/database_util.go:403] stored block receipts [56fc7c6c…]
I1023 14:31:35.147750 miner/agent.go:110] (re)started agent[0]. mining...
I1023 14:31:45.823836 eth/downloader/downloader.go:1449] Quality of service: rtt 20s, conf 1.000, ttl 1m0s
I1023 14:32:05.824104 eth/downloader/downloader.go:1449] Quality of service: rtt 20s, conf 1.000, ttl 1m0s
I1023 14:32:25.824351 eth/downloader/downloader.go:1449] Quality of service: rtt 20s, conf 1.000, ttl 1m0s
I1023 14:32:45.824589 eth/downloader/downloader.go:1449] Quality of service: rtt 20s, conf 1.000, ttl 1m0s
I1023 14:33:05.824805 eth/downloader/downloader.go:1449] Quality of service: rtt 20s, conf 1.000, ttl 1m0s
I1023 14:33:25.825033 eth/downloader/downloader.go:1449] Quality of service: rtt 20s, conf 1.000, ttl 1m0s
I1023 14:33:36.012500 miner/miner.go:136] Starting mining operation (CPU=1 TOT=2)
I1023 14:33:36.012721 core/state/state_object.go:231] 993682ad2dc9738268523da901398712e69af76e: #3 3260000840000000000000 (+ 5000000000000000000)
I1023 14:33:36.012803 miner/worker.go:539] commit new work on block 667 with 0 txs & 0 uncles. Took 261.705µs
I1023 14:33:36.012879 miner/agent.go:110] (re)started agent[0]. mining...
I1023 14:33:40.133679 core/database_util.go:368] stored block total difficulty [14ba26ec…]: 87571840
I1023 14:33:40.133827 core/database_util.go:354] stored block body [14ba26ec…]
I1023 14:33:40.133915 core/database_util.go:340] stored header #667 [14ba26ec…]
I1023 14:33:40.134320 miner/worker.go:342] 🔨  Mined block (#667 / 14ba26ec). Wait 5 blocks for confirmation
I1023 14:33:40.134436 core/database_util.go:403] stored block receipts [14ba26ec…]
I1023 14:33:40.134588 core/state/state_object.go:231] 993682ad2dc9738268523da901398712e69af76e: #3 3265000840000000000000 (+ 5000000000000000000)
I1023 14:33:40.134982 miner/worker.go:539] commit new work on block 668 with 0 txs & 0 uncles. Took 610.281µs
```

TCP dump on geth side (Filtered only the parity client):
```
14:31:34.713091 IP host-94-248-156-189.kabelnet.hu.51295 > ethads.biz.8814: Flags [.], ack 384, win 253, length 0
        0x0000:  0016 3e43 d956 0023 ebfd 817f 0800 4500  ..>C.V.#......E.
        0x0010:  0028 2d03 4000 7706 43b1 5ef8 9cbd 57e5  .(-.@.w.C.^...W.
        0x0020:  3f81 c85f 226e a5e8 ae23 1930 4d96 5010  ?.._"n...#.0M.P.
        0x0030:  00fd 761b 0000 0000 0000 0000            ..v.........
14:31:34.713194 IP host-94-248-156-189.kabelnet.hu.51295 > ethads.biz.8814: Flags [.], ack 399, win 253, length 0
        0x0000:  0016 3e43 d956 0023 ebfd 817f 0800 4500  ..>C.V.#......E.
        0x0010:  0028 2d04 4000 7706 43b0 5ef8 9cbd 57e5  .(-.@.w.C.^...W.
        0x0020:  3f81 c85f 226e a5e8 ae23 1930 4da5 5010  ?.._"n...#.0M.P.
        0x0030:  00fd 760c 0000 0000 0000 0000            ..v.........
14:31:34.717666 IP host-94-248-156-189.kabelnet.hu.51295 > ethads.biz.8814: Flags [P.], seq 384:448, ack 415, win 253, length 64
        0x0000:  0016 3e43 d956 0023 ebfd 817f 0800 4500  ..>C.V.#......E.
        0x0010:  0068 2d05 4000 7706 436f 5ef8 9cbd 57e5  .h-.@.w.Co^...W.
        0x0020:  3f81 c85f 226e a5e8 ae23 1930 4db5 5018  ?.._"n...#.0M.P.
        0x0030:  00fd c9d2 0000 5bb7 44a5 e5ce 21a5 95f5  ......[.D...!...
        0x0040:  c060 5b80 ac2f 882e 6b3d f0d6 4c35 b6d9  .`[../..k=..L5..
        0x0050:  b738 f1d5 9f8d 82c0 0bde a068 d1e6 7be3  .8.........h..{.
        0x0060:  a0b7 c4f1 391c 1060 6e8e 756a cc7c c21b  ....9..`n.uj.|..
        0x0070:  cfde cf54 3860                           ...T8`
14:31:35.145100 IP host-94-248-156-189.kabelnet.hu.51295 > ethads.biz.8814: Flags [.], ack 1087, win 256, length 0
        0x0000:  0016 3e43 d956 0023 ebfd 817f 0800 4500  ..>C.V.#......E.
        0x0010:  0028 2d0b 4000 7706 43a9 5ef8 9cbd 57e5  .(-.@.w.C.^...W.
        0x0020:  3f81 c85f 226e a5e8 ae63 1930 5055 5010  ?.._"n...c.0PUP.
        0x0030:  0100 7319 0000 0000 0000 0000            ..s.........
14:31:35.145176 IP host-94-248-156-189.kabelnet.hu.51295 > ethads.biz.8814: Flags [.], ack 1040, win 256, length 0
        0x0000:  0016 3e43 d956 0023 ebfd 817f 0800 4500  ..>C.V.#......E.
        0x0010:  0028 2d0a 4000 7706 43aa 5ef8 9cbd 57e5  .(-.@.w.C.^...W.
        0x0020:  3f81 c85f 226e a5e8 ae63 1930 5026 5010  ?.._"n...c.0P&P.
        0x0030:  0100 7348 0000 0000 0000 0000            ..sH........
14:31:35.150674 IP host-94-248-156-189.kabelnet.hu.51295 > ethads.biz.8814: Flags [P.], seq 448:608, ack 1087, win 256, length 160
        0x0000:  0016 3e43 d956 0023 ebfd 817f 0800 4500  ..>C.V.#......E.
        0x0010:  00c8 2d0c 4000 7706 4308 5ef8 9cbd 57e5  ..-.@.w.C.^...W.
        0x0020:  3f81 c85f 226e a5e8 ae63 1930 5055 5018  ?.._"n...c.0PUP.
        0x0030:  0100 6fa9 0000 2553 5dc4 dbc8 b524 f2dd  ..o...%S]....$..
        0x0040:  863f aa61 6628 4c3f c858 9134 753f 9410  .?.af(L?.X.4u?..
        0x0050:  cf53 e314 c711 d97b 53fa 26da fcdc d7de  .S.....{S.&.....
        0x0060:  0c0d 181a 0db8 dc7d 15f2 04cd 412d b876  .......}....A-.v
        0x0070:  3937 df69 b8d3 b039 8f81 eef7 4e59 24e1  97.i...9....NY$.
        0x0080:  b8f2 6618 2113 3e55 7178 6b47 fbdc da0f  ..f.!.>UqxkG....
        0x0090:  3dc9 3a7f d56c ce76 8169 fb02 30ea 8e97  =.:..l.v.i..0...
        0x00a0:  a613 503e f989 8066 d0a6 5f80 b6b8 eec8  ..P>...f.._.....
        0x00b0:  11bc f127 3096 3513 72d3 0e49 e49d 219c  ...'0.5.r..I..!.
        0x00c0:  7252 29f7 33b8 bb10 478a 5d3c 35ad 36d3  rR).3...G.]<5.6.
        0x00d0:  d04b 4c6b 053b                           .KLk.;
14:31:35.156906 IP host-94-248-156-189.kabelnet.hu.51295 > ethads.biz.8814: Flags [.], ack 1728, win 253, length 0
        0x0000:  0016 3e43 d956 0023 ebfd 817f 0800 4500  ..>C.V.#......E.
        0x0010:  0028 2d0f 4000 7706 43a5 5ef8 9cbd 57e5  .(-.@.w.C.^...W.
        0x0020:  3f81 c85f 226e a5e8 af03 1930 52d6 5010  ?.._"n.....0R.P.
        0x0030:  00fd 6ffb 0000 0000 0000 0000            ..o.........
14:31:35.157011 IP host-94-248-156-189.kabelnet.hu.51295 > ethads.biz.8814: Flags [.], ack 1766, win 253, length 0
        0x0000:  0016 3e43 d956 0023 ebfd 817f 0800 4500  ..>C.V.#......E.
        0x0010:  0028 2d10 4000 7706 43a4 5ef8 9cbd 57e5  .(-.@.w.C.^...W.
        0x0020:  3f81 c85f 226e a5e8 af03 1930 52fc 5010  ?.._"n.....0R.P.
        0x0030:  00fd 6fd5 0000 0000 0000 0000            ..o.........
14:31:35.165012 IP host-94-248-156-189.kabelnet.hu.51295 > ethads.biz.8814: Flags [P.], seq 608:768, ack 1766, win 253, length 160
        0x0000:  0016 3e43 d956 0023 ebfd 817f 0800 4500  ..>C.V.#......E.
        0x0010:  00c8 2d11 4000 7706 4303 5ef8 9cbd 57e5  ..-.@.w.C.^...W.
        0x0020:  3f81 c85f 226e a5e8 af03 1930 52fc 5018  ?.._"n.....0R.P.
        0x0030:  00fd 8dae 0000 574a 7a98 70e5 5777 fc7f  ......WJz.p.Ww..
        0x0040:  68fe 9a0d f1ed c701 fce0 fd1a eeda 18b7  h...............
        0x0050:  d724 de8b f04a ac0f 60f9 ac00 b5d0 7027  .$...J..`.....p'
        0x0060:  fda8 1bd7 21c7 392e 5298 505a 8f35 80e9  ....!.9.R.PZ.5..
        0x0070:  1193 63f5 e063 7852 3b09 8b61 6a60 2656  ..c..cxR;..aj`&V
        0x0080:  b838 6a54 740e 43f7 4253 6225 de89 c4ce  .8jTt.C.BSb%....
        0x0090:  f4f1 666b 2f5d 488f 444a a562 1fbf 502c  ..fk/]H.DJ.b..P,
        0x00a0:  56dc 02f5 9a83 72d1 a2e5 4978 3269 6327  V.....r...Ix2ic'
        0x00b0:  7ee4 35a6 5a67 4b3d 92cc c26d 16c1 ba01  ~.5.ZgK=...m....
        0x00c0:  f12a 705e a04c 147b 42b7 c0c0 71de 6c93  .*p^.L.{B...q.l.
        0x00d0:  8968 3c22 4503                           .h<"E.
14:31:35.226727 IP host-94-248-156-189.kabelnet.hu.51295 > ethads.biz.8814: Flags [.], ack 1791, win 253, length 0
        0x0000:  0016 3e43 d956 0023 ebfd 817f 0800 4500  ..>C.V.#......E.
        0x0010:  0028 2d12 4000 7706 43a2 5ef8 9cbd 57e5  .(-.@.w.C.^...W.
        0x0020:  3f81 c85f 226e a5e8 afa3 1930 5315 5010  ?.._"n.....0S.P.
        0x0030: 00fd 6f1c 0000 0000 0000 0000 ..o.........
```

**Comment by joeb000** [comment]
this could be a duplicate to: https://github.com/ethereum/go-ethereum/issues/2769

I had a similar issue when running a single geth miner on a private network and attaching other non-mining nodes. My solution/workaround was to set up a second mining node.

**Comment by iFA88** [comment]
I think this is a different issue because when i use two clients of Geth and the non miner client has `--autodag` parameter, then everything works as excepted.

**Comment by iFA88** [comment]
Update:
I have tried again send transaction between geth <-> geth using the `--autodag` parameter, but now dont works.
