### ISSUE TITLE
DNS discovery uses too large responses to fit within UDP packet size

### ISSUE THREAD

**Issue by holiman** [ethereum/go-ethereum#22532]
I'm having issues with dns discovery on some system, and digging into it, I find that the problems occur due to the UDP responses being truncated. This is a signal that the packet is too large for UDP, and that the resolver should instead try with TCP. However, if the dns server is not configured for TCP, this causes the dns lookup to fail. 

The current DNS text entries are already trying to respect the UDP max packet size (loosely defined as "keep below 512 and most things should work", as far as I can tell). 

So I dumped some traffic

```
$ sudo tcpdump -i eth0 udp port 53 or tcp port 53 -v
```
Resolving the first subtree is fine, the UDP length is `233`
```
09:04:17.136124 IP (tos 0x0, ttl 64, id 24400, offset 0, flags [none], proto UDP (17), length 98)
    work.45117 > 10.139.1.1.domain: 44463+ TXT? FVY6INQ6LZ33WLCHO3BPR3FH6Y.snap.mainnet.ethdisco.net. (70)
09:04:17.187540 IP (tos 0x0, ttl 120, id 55944, offset 0, flags [none], proto UDP (17), length 233)
    10.139.1.1.domain > work.45117: 44463 1/0/0 FVY6INQ6LZ33WLCHO3BPR3FH6Y.snap.mainnet.ethdisco.net. TXT "enrtree-branch:RXIS4YKHZSIHE3SRQSN5DHHIDA,C3DT4RMLN54YFVVNNZYIAYC6OY,2IA54GZNAVRMOHZVPKL5YDCSZQ,CCETEMV6KS4NMQ3U2QFFSOWBKQ" (205)
```
Query for the second subtree: 
```
09:04:31.795554 IP (tos 0x0, ttl 64, id 36130, offset 0, flags [none], proto UDP (17), length 98)
    work.51703 > 10.139.1.1.domain: 327+ TXT? RXIS4YKHZSIHE3SRQSN5DHHIDA.snap.mainnet.ethdisco.net. (70)
```
We now get a truncated answer (length `98`)
```
09:04:31.852798 IP (tos 0x0, ttl 120, id 12711, offset 0, flags [none], proto UDP (17), length 98)
    10.139.1.1.domain > work.51703: 327| 0/0/0 (70)
```
The resolves switches over to TCP, and repeats the query: 
```
09:04:31.853120 IP (tos 0x0, ttl 64, id 52757, offset 0, flags [DF], proto TCP (6), length 52)
    work.58713 > 10.139.1.1.domain: Flags [S], cksum 0x164a (incorrect -> 0x13a2), seq 1759706089, win 64240, options [mss 1460,nop,nop,sackOK,nop,wscale 7], length 0
09:04:31.856111 IP (tos 0x0, ttl 121, id 24488, offset 0, flags [none], proto TCP (6), length 52)
    10.139.1.1.domain > work.58713: Flags [S.], cksum 0x4e98 (correct), seq 2862355818, ack 1759706090, win 65535, options [mss 1430,nop,nop,sackOK,nop,wscale 8], length 0
09:04:31.856153 IP (tos 0x0, ttl 64, id 52758, offset 0, flags [DF], proto TCP (6), length 40)
    work.58713 > 10.139.1.1.domain: Flags [.], cksum 0x163e (incorrect -> 0x8d57), ack 1, win 502, length 0
09:04:31.856254 IP (tos 0x0, ttl 64, id 52759, offset 0, flags [DF], proto TCP (6), length 112)
    work.58713 > 10.139.1.1.domain: Flags [P.], cksum 0x1686 (incorrect -> 0xec80), seq 1:73, ack 1, win 502, length 72 967+ TXT? RXIS4YKHZSIHE3SRQSN5DHHIDA.snap.mainnet.ethdisco.net. (70)
```
And we get the answer over TCP:     
```
09:04:31.859799 IP (tos 0x0, ttl 121, id 24489, offset 0, flags [none], proto TCP (6), length 40)
    10.139.1.1.domain > work.58713: Flags [.], cksum 0x8e05 (correct), ack 73, win 256, length 0
09:04:31.893202 IP (tos 0x0, ttl 121, id 24496, offset 0, flags [none], proto TCP (6), length 626)
    10.139.1.1.domain > work.58713: Flags [P.], cksum 0x6408 (correct), seq 1:587, ack 73, win 256, length 586 967 1/0/0 RXIS4YKHZSIHE3SRQSN5DHHIDA.snap.mainnet.ethdisco.net. TXT "enrtree-branch:SV2V3K7KGUVMSAD245OWSAYIE4,6WO3U2BWS4RVD5I64DU2RZT6JY,C6HYYZ6KSNADKYPA3XVRXWOKCU,ROEUSPX3ICH2JMCWFYOLAQFPYI,MEDEWK7LGJCD6UI5G3LE7QQ3PE,YXJE6QRFSFP3GDZH4H6OO76OAA,6P6GDCI4N2O66UY7VGWGOFVVKM,YNEWWXC3SXUOVMAQ35B5RNW6AY,NCK4W2I2HITTUL3MD5WDN6" "PMDY,7VMLUPBZD6POCYBBXS6GHDSNDE,QJPWVWE362BN4GFWHT3IWMNJYY,N7OIP7PHPTX7WDK6AYZOO6BJQM,HXDHTARBLJVKQ7QJQREE3Q5PGY,5IBMC3O6NJR3JIGVWVSVJOELSE,7CPQSKGAVFCFUBLHSGKNZPC7OM,WINX3IXUGKCA5KZ2XI6RZNMV4M,J24AQYV4NBOCFLEHCAUOMQJMZU,A3ACMJQQXS5HCLB23IGE24L6XA" (584)
09:04:31.893240 IP (tos 0x0, ttl 64, id 52760, offset 0, flags [DF], proto TCP (6), length 40)
    work.58713 > 10.139.1.1.domain: Flags [.], cksum 0x163e (incorrect -> 0x8ac9), ack 587, win 498, length 0
09:04:31.893543 IP (tos 0x0, ttl 64, id 52761, offset 0, flags [DF], proto TCP (6), length 40)
    work.58713 > 10.139.1.1.domain: Flags [F.], cksum 0x163e (incorrect -> 0x8ac5), seq 73, ack 587, win 501, length 0
09:04:31.897287 IP (tos 0x0, ttl 121, id 24505, offset 0, flags [none], proto TCP (6), length 40)
    10.139.1.1.domain > work.58713: Flags [F.], cksum 0x8bb9 (correct), seq 587, ack 74, win 256, length 0
09:04:31.897332 IP (tos 0x0, ttl 64, id 52762, offset 0, flags [DF], proto TCP (6), length 40)
    work.58713 > 10.139.1.1.domain: Flags [.], cksum 0x163e (incorrect -> 0x8ac4), ack 588, win 501, length 0
```

So the second answer was length `586`. 

```
FVY6INQ6LZ33WLCHO3BPR3FH6Y.snap.mainnet.ethdisco.net. TXT "enrtree-branch:RXIS4YKHZSIHE3SRQSN5DHHIDA,C3DT4RMLN54YFVVNNZYIAYC6OY,2IA54GZNAVRMOHZVPKL5YDCSZQ,CCETEMV6KS4NMQ3U2QFFSOWBKQ"
RXIS4YKHZSIHE3SRQSN5DHHIDA.snap.mainnet.ethdisco.net. TXT "enrtree-branch:SV2V3K7KGUVMSAD245OWSAYIE4,6WO3U2BWS4RVD5I64DU2RZT6JY,C6HYYZ6KSNADKYPA3XVRXWOKCU,ROEUSPX3ICH2JMCWFYOLAQFPYI,MEDEWK7LGJCD6UI5G3LE7QQ3PE,YXJE6QRFSFP3GDZH4H6OO76OAA,6P6GDCI4N2O66UY7VGWGOFVVKM,YNEWWXC3SXUOVMAQ35B5RNW6AY,NCK4W2I2HITTUL3MD5WDN6" "PMDY,7VMLUPBZD6POCYBBXS6GHDSNDE,QJPWVWE362BN4GFWHT3IWMNJYY,N7OIP7PHPTX7WDK6AYZOO6BJQM,HXDHTARBLJVKQ7QJQREE3Q5PGY,5IBMC3O6NJR3JIGVWVSVJOELSE,7CPQSKGAVFCFUBLHSGKNZPC7OM,WINX3IXUGKCA5KZ2XI6RZNMV4M,J24AQYV4NBOCFLEHCAUOMQJMZU,A3ACMJQQXS5HCLB23IGE24L6XA"
```

Dissecting some DNS traffic in wireshark, here's the overhead: 
```

UDP length = 8 + UDP payload length ( 229 )
UPD Payload length:
  - dns.id 2
  - dns.flags 2 
  - dns.count.queries 2
  - dns.count.answers 2 
  - dns.count.auth_rr 2
  - dns.count.add_rr 2
  - queries (query-size + 6)
  - answers : 
  	- dns.resp.name 2
  	- dns.resp.type 2
  	- dns.resp.class 2
  	- dns.resp.ttl 4
  	- dns.resp.len 2
  	- dns.txt.length 1
  	- dns.txt resp_data_size
```
So for `snap.mainnet.ethdisco.net` with response `enrtree-root:v1 e=FVY6INQ6LZ33WLCHO3BPR3FH6Y l=FDXN3SN67NA5DKA4J2GOK7BVQI seq=320 sig=XaQL_WbxJbm6o8olxLkPxVJCL6jQevz_3DIFl40V25R9P3ioD0Vld_jMuGLJ3BGD4d6MdSorAudYoJoFF1G-iAE`, we get: 

`31` + query_size (`25`) + data_size (`173`) = `229`, and total UDP size of `237`. 
Fixed overhead: `31+8=39`

When we make the DNS text entries, we should therefore
- The response size must keep below `473-query_size`, where
  - query_size is the length of the incoming domain, as a string (e.g. `snap.mainnet.ethdisco.net`).

**Comment by holiman** [comment]
Let's assume the query size is around `FVY6INQ6LZ33WLCHO3BPR3FH6Y.snap.mainnet.ethdisco.net` (`52`). Then the max response text size is `473-52`=`421`.
The response texti is `len("enrtree-branch:"`) = `15`, so there's `406` left. Each child is `27` (encoded hash size plus comma). 
Example (oversize) response: 
```
"enrtree-branch:SV2V3K7KGUVMSAD245OWSAYIE4,6WO3U2BWS4RVD5I64DU2RZT6JY,C6HYYZ6KSNADKYPA3XVRXWOKCU,ROEUSPX3ICH2JMCWFYOLAQFPYI,MEDEWK7LGJCD6UI5G3LE7QQ3PE,YXJE6QRFSFP3GDZH4H6OO76OAA,6P6GDCI4N2O66UY7VGWGOFVVKM,YNEWWXC3SXUOVMAQ35B5RNW6AY,NCK4W2I2HITTUL3MD5WDN6" "PMDY,7VMLUPBZD6POCYBBXS6GHDSNDE,QJPWVWE362BN4GFWHT3IWMNJYY,N7OIP7PHPTX7WDK6AYZOO6BJQM,HXDHTARBLJVKQ7QJQREE3Q5PGY,5IBMC3O6NJR3JIGVWVSVJOELSE,7CPQSKGAVFCFUBLHSGKNZPC7OM,WINX3IXUGKCA5KZ2XI6RZNMV4M,J24AQYV4NBOCFLEHCAUOMQJMZU,A3ACMJQQXS5HCLB23IGE24L6XA"
```
That's `18` children, so `18*27= 486`, which goes over the limit we had of `406`.

**Comment by holiman** [comment]
Setting max children to `15` would have _barely maybe_ been ok (`405`), setting `14` would be more conservative (`378`), allowing for some extra bytes for splitting with `" "`. So maybe just hardcode `maxChildren` to `14` (or `13` to allow for longer DNS names as selectors)

**Comment by holiman** [comment]
Verification that this is now resolved : zero truncation / switching over to TCP when resolving the first paths down to a leaf: 
```
[user@work ~]$ nslookup
> set TYPE=txt
> snap.mainnet.ethdisco.net
Server:		10.139.1.1
Address:	10.139.1.1#53

Non-authoritative answer:
snap.mainnet.ethdisco.net	text = "enrtree-root:v1 e=DV52PURXACX3PF4VO6WP2L3Z3M l=FDXN3SN67NA5DKA4J2GOK7BVQI seq=326 sig=LIHIe7Auj9HwF2U1424S1pl1QFFbHKDUB99co8KH1Cdg0w3sIpZtfyWoXRE6TUZISmn5A0IYvmnndUDWjqOf3QA"

Authoritative answers can be found from:
> DV52PURXACX3PF4VO6WP2L3Z3M.snap.mainnet.ethdisco.net
Server:		10.139.1.1
Address:	10.139.1.1#53

Non-authoritative answer:
DV52PURXACX3PF4VO6WP2L3Z3M.snap.mainnet.ethdisco.net	text = "enrtree-branch:LFAHPGIYI4SXSFCS4XFSHRYNFI,IIZJF7FV5NFW6PYODPZNTHOUN4,I2CXAJHD6H4S53KB5RWOFWTFYE,O27K5J6NOBQDITWD6U2HOLD5A4,HOW5EJQFDB4GLEXYOWRMDVVZQE,PTBGMUR24G6PJZTQN3D4FWLTKE,HS6VVPUH5MPCR2OULS7FQC7B3Y,HY6Q7E3K6PIXDCLVBSU7YI2MWA"

Authoritative answers can be found from:
> LFAHPGIYI4SXSFCS4XFSHRYNFI.snap.mainnet.ethdisco.net
Server:		10.139.1.1
Address:	10.139.1.1#53

Non-authoritative answer:
LFAHPGIYI4SXSFCS4XFSHRYNFI.snap.mainnet.ethdisco.net	text = "enrtree-branch:NPNWO4VX4HWHN6QPK3W3AMOVDA,QGISXHT6MJMQJQ6ENYG3IQYWW4,HVS3X375MTPR7F7TM7UNS6JONQ,BMMKBPUFY3FH5KP6I53IUJZHUM,42Q3MA42F5MC3MMB7YEM3HTVFU,KUHBLLV4ZCS5J4UGTYV4V56DIQ,SJ3VT3KICA2DW2FN2JYSBL4RSE,B2XWOWTX4FW7J64EOQIDNMBCKA,WKFOAR36YETPRWMKC4R3IP" "NNNQ,J2AHEYNERIGI4FE375SYP3GYAU,LMHSDQZFNKYDFL5KX2RE5JPTRQ,O65TCDJCTHGMICG7LWPXZHTUK4,O3NIQKI73D6E5LARRCA66744T4"

Authoritative answers can be found from:
> NPNWO4VX4HWHN6QPK3W3AMOVDA.snap.mainnet.ethdisco.net
Server:		10.139.1.1
Address:	10.139.1.1#53

Non-authoritative answer:
NPNWO4VX4HWHN6QPK3W3AMOVDA.snap.mainnet.ethdisco.net	text = "enrtree-branch:ON6IT2HY7XYTN6LWQWQNOLIPSI,2PASTD5Q45IXFT3YGIHC53XMGU,32ZQC73IEQWKT2CN733272XUEU,F4DDAHHNFIZI6OHNNTJNWIGJHY,THIR2TVAPFX6AGEQUVFZWDBU7A,VD767RPL37NXZHGBJT2PTLPQNM,SKDWWJN3K7ZHRATU4JMTR2S3X4,URVQPYEXX54JRJDOVVHCSDG2D4,IEUQQGRKC47EXSYW2T47B4" "DJBM,V7VEDCSRNNH44MSOIIQTJ22KZQ,YQQW4NSA76FRKSOH5X4HKY2UAI,2ZAOXB7EK63SWWFHSZ2VNWOCRI,D4KR5537QDCFBKYCJ6OLIHS5GU"

Authoritative answers can be found from:
> ON6IT2HY7XYTN6LWQWQNOLIPSI.snap.mainnet.ethdisco.net
Server:		10.139.1.1
Address:	10.139.1.1#53

Non-authoritative answer:
ON6IT2HY7XYTN6LWQWQNOLIPSI.snap.mainnet.ethdisco.net	text = "enr:-KC4QGXRKFgo6zxOp8f_etF4gpt9jt1xT5q726rv6pHJjoSsaHaapDeomC-A8OWRqxFMCj2W3nMYZ_ocxa9dYkZUa38Mg2V0aMrJhOAp6ZGDutQggmlkgnY0gmlwhCOeWYeJc2VjcDI1NmsxoQKTK1npdFB4lfU4VXQDNZ8urePdEkLzdhT8hufBDRMEUIRzbmFwwIN0Y3CCdl-DdWRwgnZf"

Authoritative answers can be found from:
```
